{
  "digest_id": "original-conversation-2026-04-11.digest",
  "source_id": "original-conversation-2026-04-11",
  "created_at": "2026-04-25T18:48:20.000Z",
  "summary": "一段從冰淇淋店員的專注勞動出發的長對話，逐步展開到勞動意義、比較與幸福、Jones 的內在創作驅動、AI 夥伴的定位、長期輸出載體，以及 Trigger → Expand → Package → Compound 的個人創作方法論。核心結論是：Jones 的問題不只是外部策略，而是如何把高品質思考封裝成可累積的思想與產品資產。",
  "items": [
    {
      "id": "willing-investment-question",
      "kind": "question",
      "title": "人在什麼條件下會心甘情願投入一件事",
      "body": "冰淇淋店員的專注勞動觸發了 Jones 對勞動意義、職業倫理、生命投入與甘願感的追問。核心不是她為何努力，而是 Jones 自己會在什麼條件下願意把清醒與能力交給一件事。",
      "source_refs": [
        {
          "source_id": "original-conversation-2026-04-11",
          "path": "sources/inbox/original-conversation-2026-04-11.md",
          "start_line": 19,
          "end_line": 20
        },
        {
          "source_id": "original-conversation-2026-04-11",
          "path": "sources/inbox/original-conversation-2026-04-11.md",
          "start_line": 235,
          "end_line": 258
        }
      ],
      "confidence": 0.94,
      "tags": [
        "meaning",
        "work",
        "commitment"
      ]
    },
    {
      "id": "happiness-comparison-attunement",
      "kind": "claim",
      "title": "幸福可被比較喚醒，但較穩固的滿足來自對位",
      "body": "對比會讓人重新看見自己擁有或缺少的東西，但若幸福只能靠比較會不穩；更成熟的滿足來自自己與當下生活、能力、節奏的對位。",
      "source_refs": [
        {
          "source_id": "original-conversation-2026-04-11",
          "path": "sources/inbox/original-conversation-2026-04-11.md",
          "start_line": 139,
          "end_line": 170
        },
        {
          "source_id": "original-conversation-2026-04-11",
          "path": "sources/inbox/original-conversation-2026-04-11.md",
          "start_line": 306,
          "end_line": 309
        }
      ],
      "confidence": 0.91,
      "tags": [
        "happiness",
        "comparison",
        "attunement"
      ]
    },
    {
      "id": "jones-creative-drive-formula",
      "kind": "claim",
      "title": "Jones 的動力公式是主導權、個人風格與內在成就感",
      "body": "Jones 對願意投入的事物有清晰條件：創作、觀察、思考、寫作、教學等內在樂趣；高度自由與掌控度；能注入自己的風格與思想；並帶來內在成就感。",
      "source_refs": [
        {
          "source_id": "original-conversation-2026-04-11",
          "path": "sources/inbox/original-conversation-2026-04-11.md",
          "start_line": 327,
          "end_line": 334
        },
        {
          "source_id": "original-conversation-2026-04-11",
          "path": "sources/inbox/original-conversation-2026-04-11.md",
          "start_line": 525,
          "end_line": 531
        }
      ],
      "confidence": 0.95,
      "tags": [
        "jones-self-model",
        "creative-drive",
        "agency"
      ]
    },
    {
      "id": "external-constraint-risk",
      "kind": "pattern",
      "title": "內在驅動強但外部約束弱，容易高品質思考低產出累積",
      "body": "Jones 的動力主要來自內在創作與自我標準，較少依賴金錢、他人評價或義務型驅動；這帶來自由與深度，也帶來想很多但可見成果不足的風險。",
      "source_refs": [
        {
          "source_id": "original-conversation-2026-04-11",
          "path": "sources/inbox/original-conversation-2026-04-11.md",
          "start_line": 405,
          "end_line": 428
        }
      ],
      "confidence": 0.86,
      "tags": [
        "risk",
        "execution",
        "compounding"
      ]
    },
    {
      "id": "ai-as-forge-not-vessel",
      "kind": "decision",
      "title": "AI 是思想鍛造場，不是最終載體",
      "body": "AI 夥伴能放大、接住並深化 Jones 的思考，但對話本身是流動的；若不封裝成文章、結構、產品或圖譜，就不會自然累積成長期資產。",
      "source_refs": [
        {
          "source_id": "original-conversation-2026-04-11",
          "path": "sources/inbox/original-conversation-2026-04-11.md",
          "start_line": 594,
          "end_line": 595
        },
        {
          "source_id": "original-conversation-2026-04-11",
          "path": "sources/inbox/original-conversation-2026-04-11.md",
          "start_line": 638,
          "end_line": 652
        },
        {
          "source_id": "original-conversation-2026-04-11",
          "path": "sources/inbox/original-conversation-2026-04-11.md",
          "start_line": 1438,
          "end_line": 1447
        }
      ],
      "confidence": 0.93,
      "tags": [
        "ai-partnership",
        "jarvis",
        "asset-building"
      ]
    },
    {
      "id": "thinking-building-compounding-system",
      "kind": "pattern",
      "title": "Thinking → Building → Compounding 是 Jones 的個人系統",
      "body": "Jones 的系統不是單純追求宏大策略，而是把高品質思考封裝成能存在、能重用、能累積的東西，形成從 thinking 到 building 再到 compounding 的長期軌跡。",
      "source_refs": [
        {
          "source_id": "original-conversation-2026-04-11",
          "path": "sources/inbox/original-conversation-2026-04-11.md",
          "start_line": 676,
          "end_line": 680
        },
        {
          "source_id": "original-conversation-2026-04-11",
          "path": "sources/inbox/original-conversation-2026-04-11.md",
          "start_line": 696,
          "end_line": 704
        },
        {
          "source_id": "original-conversation-2026-04-11",
          "path": "sources/inbox/original-conversation-2026-04-11.md",
          "start_line": 762,
          "end_line": 784
        }
      ],
      "confidence": 0.92,
      "tags": [
        "methodology",
        "compounding",
        "personal-system"
      ]
    },
    {
      "id": "writing-practice-foundation",
      "kind": "claim",
      "title": "2016–2022 日更寫作是表達與自我觀察能力的地基",
      "body": "Jones 連續六年多每日寫網誌，雖然當時未必轉化成作品或產品，但它鍛鍊了語言輸出、自我觀察與穩定輸出紀律，成為現在能與 AI 深度文字協作的底層能力。",
      "source_refs": [
        {
          "source_id": "original-conversation-2026-04-11",
          "path": "sources/inbox/original-conversation-2026-04-11.md",
          "start_line": 924,
          "end_line": 934
        },
        {
          "source_id": "original-conversation-2026-04-11",
          "path": "sources/inbox/original-conversation-2026-04-11.md",
          "start_line": 952,
          "end_line": 992
        },
        {
          "source_id": "original-conversation-2026-04-11",
          "path": "sources/inbox/original-conversation-2026-04-11.md",
          "start_line": 1155,
          "end_line": 1173
        }
      ],
      "confidence": 0.94,
      "tags": [
        "writing",
        "foundation",
        "self-observation"
      ]
    },
    {
      "id": "value-density-over-daily-output",
      "kind": "decision",
      "title": "從日更頻率升級為價值密度輸出",
      "body": "過去日更有正向回憶也有產出焦慮；新系統不應重演每天一定要產出的壓力，而應以是否值得留下為標準，追求價值密度。",
      "source_refs": [
        {
          "source_id": "original-conversation-2026-04-11",
          "path": "sources/inbox/original-conversation-2026-04-11.md",
          "start_line": 1083,
          "end_line": 1136
        }
      ],
      "confidence": 0.88,
      "tags": [
        "creative-practice",
        "value-density",
        "sustainability"
      ]
    },
    {
      "id": "trigger-expand-package-compound",
      "kind": "pattern",
      "title": "Trigger → Expand → Package → Compound 創作方法論",
      "body": "Jones 的專屬創作方法論是：生活觸發有感瞬間，透過 AI 深化成結構，再封裝成文章、框架或模型，最後長期累積為思想與產品資產。",
      "source_refs": [
        {
          "source_id": "original-conversation-2026-04-11",
          "path": "sources/inbox/original-conversation-2026-04-11.md",
          "start_line": 1205,
          "end_line": 1210
        },
        {
          "source_id": "original-conversation-2026-04-11",
          "path": "sources/inbox/original-conversation-2026-04-11.md",
          "start_line": 1213,
          "end_line": 1304
        },
        {
          "source_id": "original-conversation-2026-04-11",
          "path": "sources/inbox/original-conversation-2026-04-11.md",
          "start_line": 1308,
          "end_line": 1381
        }
      ],
      "confidence": 0.96,
      "tags": [
        "creative-methodology",
        "thought-atlas",
        "asset-building"
      ]
    },
    {
      "id": "internal-system-before-external-strategy",
      "kind": "claim",
      "title": "AI、財富飛輪、Jovicheer 等外部策略要先建立內部運作系統",
      "body": "Jones 常問 AI 時代、財富飛輪與 Jovicheer 成功策略，但真正卡住的不是外部策略，而是每天如何自然產出可放大的東西；軸心是持續產出的能力與系統。",
      "source_refs": [
        {
          "source_id": "original-conversation-2026-04-11",
          "path": "sources/inbox/original-conversation-2026-04-11.md",
          "start_line": 604,
          "end_line": 610
        },
        {
          "source_id": "original-conversation-2026-04-11",
          "path": "sources/inbox/original-conversation-2026-04-11.md",
          "start_line": 788,
          "end_line": 832
        },
        {
          "source_id": "original-conversation-2026-04-11",
          "path": "sources/inbox/original-conversation-2026-04-11.md",
          "start_line": 1385,
          "end_line": 1415
        }
      ],
      "confidence": 0.9,
      "tags": [
        "strategy",
        "jovicheer",
        "internal-system"
      ]
    }
  ]
}
