{
  "digest_id": "ai-selection-jev-play-the-ball-2026-09-21.digest",
  "source_id": "ai-selection-jev-play-the-ball-2026-09-21",
  "created_at": "2026-09-25T05:00:00.000Z",
  "summary": "這段 2026-09-21 的 Jones × GPT 對話從「node / edge」直覺出發，整理出 AI 能力正沿 Node → Edge → Graph → Selection 一路往下吃的 stack；JEV 讓 AI 進入 selection layer 成為具體現象，逼出「人還要保留什麼」的問題。回答是：selection 可以被 AI 協助，但 commitment（認領哪段人生）與 transformation（路徑改寫做選擇的人）留在人身上。生活策略因此收斂為「方向穩定，路徑流動」與「有球來就打」：保留低解析度方向、維持可回應性、不把當下抵押給脆弱的遠期 roadmap，並把這次對話定位為 Jones 1.0 → 4.0 自我探索序列之後的 Selection Patch。",
  "items": [
    {
      "id": "ai-capability-stack-node-to-selection",
      "kind": "pattern",
      "title": "AI 能力正從 Node → Edge → Graph 一路往下吃進 Selection",
      "body": "對話把 AI 能力遷移整理成 Node → Edge → Graph → Selection → Commitment → Transformation 的 stack：找答案（node）的稀缺性快速下降；看見跨節點關聯（edge）與理解整體結構（graph）也正在自動化；JEV 類工具則讓 AI 進入 selection layer，對選項加權、排序、推薦下一步。因此人的生活策略不應建立在「我永遠會比 AI 更會找答案或做選擇」的假設上。",
      "source_refs": [
        {
          "source_id": "ai-selection-jev-play-the-ball-2026-09-21",
          "path": "sources/inbox/ai-selection-jev-play-the-ball-2026-09-21.md",
          "start_line": 5,
          "end_line": 9,
          "quote": "edge、graph，甚至 selection 本身，也都正在被 AI 吃掉。"
        },
        {
          "source_id": "ai-selection-jev-play-the-ball-2026-09-21",
          "path": "sources/inbox/ai-selection-jev-play-the-ball-2026-09-21.md",
          "start_line": 17,
          "end_line": 55,
          "quote": "Graph-level 的觀察也正在快速自動化。"
        },
        {
          "source_id": "ai-selection-jev-play-the-ball-2026-09-21",
          "path": "sources/inbox/ai-selection-jev-play-the-ball-2026-09-21.md",
          "start_line": 164,
          "end_line": 170,
          "quote": "AI 正在一路從 Node → Edge → Graph → Selection 往下走。"
        }
      ],
      "confidence": 0.95,
      "tags": [
        "ai-selection",
        "capability-migration",
        "jev",
        "ai-collaboration"
      ]
    },
    {
      "id": "what-humans-keep-when-ai-selects",
      "kind": "question",
      "title": "當 AI 也會連線、建圖、加權、推薦，人還要保留什麼？",
      "body": "JEV 讓「AI 從幫我想往幫我選再推一步」不再只是哲學假設。對話的真正新問題因此變成：當 AI 不只會回答，也會連線、建圖、比較、加權、推薦，人還要保留什麼？",
      "source_refs": [
        {
          "source_id": "ai-selection-jev-play-the-ball-2026-09-21",
          "path": "sources/inbox/ai-selection-jev-play-the-ball-2026-09-21.md",
          "start_line": 9,
          "end_line": 13,
          "quote": "當 AI 不只會回答，也會連線、建圖、比較、加權、推薦，人還要保留什麼？"
        },
        {
          "source_id": "ai-selection-jev-play-the-ball-2026-09-21",
          "path": "sources/inbox/ai-selection-jev-play-the-ball-2026-09-21.md",
          "start_line": 50,
          "end_line": 53,
          "quote": "它把 AI 從「幫我想」往「幫我選」再推一步。"
        }
      ],
      "confidence": 0.94,
      "tags": [
        "ai-selection",
        "jev",
        "human-role",
        "question"
      ]
    },
    {
      "id": "ai-recommendation-is-not-commitment",
      "kind": "decision",
      "title": "AI 可以推薦最優選項，但不能替人認領人生",
      "body": "即使 AI 認為某個選項 expected value 最高，「這是不是我要認領的人生？」也不會被更好的排序消除。Commitment 不是知道哪個選項最優，而是願意真的走進某條路並承受它的成本與後果。原則是讓 AI 幫忙看圖、算權重、提出選擇，但由自己決定哪一段人生值得親自走過。",
      "source_refs": [
        {
          "source_id": "ai-selection-jev-play-the-ball-2026-09-21",
          "path": "sources/inbox/ai-selection-jev-play-the-ball-2026-09-21.md",
          "start_line": 57,
          "end_line": 62,
          "quote": "這是不是我要認領的人生？"
        },
        {
          "source_id": "ai-selection-jev-play-the-ball-2026-09-21",
          "path": "sources/inbox/ai-selection-jev-play-the-ball-2026-09-21.md",
          "start_line": 170,
          "end_line": 172,
          "quote": "讓 AI 幫忙看圖、算權重、提出選擇，但由自己決定哪一段人生值得親自走過。"
        }
      ],
      "confidence": 0.96,
      "tags": [
        "commitment",
        "ai-selection",
        "agency",
        "ai-collaboration"
      ]
    },
    {
      "id": "choice-transforms-the-chooser",
      "kind": "claim",
      "title": "選擇會改寫做選擇的人，人生不是固定 utility function 上的 argmax",
      "body": "選擇不是發生在固定的人身上。走進某條路之後，那段經驗會反過來改變偏好、能力、世界模型與下一次選擇；做決定的人本身也會被路徑改寫，因此人生不是在固定 utility function 上反覆 argmax。",
      "source_refs": [
        {
          "source_id": "ai-selection-jev-play-the-ball-2026-09-21",
          "path": "sources/inbox/ai-selection-jev-play-the-ball-2026-09-21.md",
          "start_line": 64,
          "end_line": 69,
          "quote": "做決定的人本身，也會被路徑改寫。"
        }
      ],
      "confidence": 0.93,
      "tags": [
        "transformation",
        "commitment",
        "decision-theory",
        "self-model"
      ]
    },
    {
      "id": "direction-stable-path-fluid",
      "kind": "decision",
      "title": "方向穩定，路徑流動",
      "body": "AI 讓未來更難被高解析度預測，因此越不值得把大量當下自由度抵押給一張高度具體、假設多年後仍成立的 roadmap。可以保留低解析度方向（健康、好奇、創造能力、重要關係、移動與退出空間），但具體路線應允許重寫。這是 Jones 3.0「方向可以堅持，過程不必控制」在 AI selection 背景下的更新版。",
      "source_refs": [
        {
          "source_id": "ai-selection-jev-play-the-ball-2026-09-21",
          "path": "sources/inbox/ai-selection-jev-play-the-ball-2026-09-21.md",
          "start_line": 73,
          "end_line": 91,
          "quote": "方向穩定，路徑流動。"
        },
        {
          "source_id": "ai-selection-jev-play-the-ball-2026-09-21",
          "path": "sources/inbox/ai-selection-jev-play-the-ball-2026-09-21.md",
          "start_line": 119,
          "end_line": 121,
          "quote": "方向可以堅持，過程不必控制。"
        },
        {
          "source_id": "ai-selection-jev-play-the-ball-2026-09-21",
          "path": "sources/inbox/ai-selection-jev-play-the-ball-2026-09-21.md",
          "start_line": 174,
          "end_line": 176,
          "quote": "方向穩定，路徑流動；保持自己在場上，有球來就打。"
        }
      ],
      "confidence": 0.97,
      "tags": [
        "life-strategy",
        "direction",
        "roadmap",
        "freedom"
      ]
    },
    {
      "id": "play-the-ball-when-it-comes",
      "kind": "pattern",
      "title": "有球來就打：把規劃從固定路線改成維持可回應性",
      "body": "不要要求自己現在就預測三年後球會從哪裡飛來；保持自己在場上，球真的來了就打。這不是放棄規劃，而是維持可回應性：持續接觸新事物讓自己看得到球、有興趣就快速試而不必先證明它是十年主線、新資訊出現就改路而不把轉彎當失敗、不把任何職稱、技能或 project 當成永久身份、不因下一顆球不同就否定上一顆球的價值。",
      "source_refs": [
        {
          "source_id": "ai-selection-jev-play-the-ball-2026-09-21",
          "path": "sources/inbox/ai-selection-jev-play-the-ball-2026-09-21.md",
          "start_line": 95,
          "end_line": 109,
          "quote": "保持自己在場上，球真的來了，就打。"
        }
      ],
      "confidence": 0.96,
      "tags": [
        "play-the-ball",
        "life-strategy",
        "responsiveness",
        "adaptability"
      ]
    },
    {
      "id": "present-is-not-future-consumable",
      "kind": "claim",
      "title": "當下不是未來的耗材",
      "body": "未來因 AI 更難被預測，把現在全部犧牲給某個高度具體的遠期版本成本變得更高。今天做了一件有趣的事、學懂一個概念、做出一個小東西、跟重要的人相處、去了沒去過的地方，那一天本身就已成立；真正經歷過、理解過、被改變過的東西，不會因未來 AI 把相關技能商品化就被追溯作廢。",
      "source_refs": [
        {
          "source_id": "ai-selection-jev-play-the-ball-2026-09-21",
          "path": "sources/inbox/ai-selection-jev-play-the-ball-2026-09-21.md",
          "start_line": 111,
          "end_line": 111,
          "quote": "不會因為未來 AI 把相關技能商品化，就被追溯作廢"
        },
        {
          "source_id": "ai-selection-jev-play-the-ball-2026-09-21",
          "path": "sources/inbox/ai-selection-jev-play-the-ball-2026-09-21.md",
          "start_line": 115,
          "end_line": 133,
          "quote": "那一天本身就已經成立"
        }
      ],
      "confidence": 0.94,
      "tags": [
        "present-value",
        "time",
        "lived-experience",
        "life-strategy"
      ]
    },
    {
      "id": "jones-version-lineage-selection-patch",
      "kind": "pattern",
      "title": "Jones 1.0 → 4.0 自我探索序列與 2026-09-21 Selection Patch",
      "body": "對話把自己放進一條逐版更新的自我探索序列：Jones 1.0 我是怎麼運作的（操作說明書、思考指紋、自訂框架）；2.0 我要把自己用在哪裡（身份與志業）；3.0 我要怎麼和時間一起活；4.0 我要怎麼讓內在世界進入共同世界；2026-09-21 Selection Patch 則問當 AI 連「幫我選」都開始變強時要怎麼活，答案是方向穩定、路徑流動、有球來就打。",
      "source_refs": [
        {
          "source_id": "ai-selection-jev-play-the-ball-2026-09-21",
          "path": "sources/inbox/ai-selection-jev-play-the-ball-2026-09-21.md",
          "start_line": 137,
          "end_line": 150,
          "quote": "當 AI 連「幫我選」都開始變強，我要怎麼活？"
        }
      ],
      "confidence": 0.88,
      "tags": [
        "jones-lineage",
        "self-model",
        "identity",
        "life-design"
      ]
    }
  ]
}
