{
  "digest_id": "ai-irreplaceability-lived-experience-2026-09-25.digest",
  "source_id": "ai-irreplaceability-lived-experience-2026-09-25",
  "created_at": "2026-09-25T05:02:00.000Z",
  "summary": "這段 2026-09-25 的 Jones × GPT 對話明確延續 9/21，把外在行動策略往內推到身份層：當 AI 可能以近乎零邊際成本複製一個人多年累積的稀缺技能，把自我價值建立在不可取代性上會變得不穩。努力沒有消失，只是理由從證明稀缺轉向真的想做；成果可以被商品化，經歷不會被追溯作廢；execution 趨近免費後，稀缺性上移到 taste、curiosity、intent 與值得活過的經歷；AI 讓作為商品的技能貶值、讓作為活動的創造升值。這不是躺平，而是把野心轉向探索。最後與「有球來就打」合成一外一內兩條原則，並收斂為 durable line：不必成為不可取代的人；只要不要錯過自己真正想活的人生。",
  "items": [
    {
      "id": "irreplaceability-is-unstable-self-worth-foundation",
      "kind": "claim",
      "title": "把自我價值建立在不可取代性上，在 AI 時代是不穩的地基",
      "body": "傳統敘事是花多年練能力 → 變稀有 → 成為別人做不到的人 → 取得工作、地位、認可 → 證明自己有價值。當 AI 可能以近乎零邊際成本複製一個人二十年累積的稀缺技能，建立在「我會一件別人不會的事情」上的自我價值會非常不穩；「不可取代」越來越像一個短暫、外部決定、無法控制的狀態，因此不應把成為不可取代的人當成人生目標。",
      "source_refs": [
        {
          "source_id": "ai-irreplaceability-lived-experience-2026-09-25",
          "path": "sources/inbox/ai-irreplaceability-lived-experience-2026-09-25.md",
          "start_line": 6,
          "end_line": 8,
          "quote": "人的價值還應該建立在哪裡？"
        },
        {
          "source_id": "ai-irreplaceability-lived-experience-2026-09-25",
          "path": "sources/inbox/ai-irreplaceability-lived-experience-2026-09-25.md",
          "start_line": 22,
          "end_line": 64,
          "quote": "不要把「成為不可取代的人」當成人生目標。"
        }
      ],
      "confidence": 0.96,
      "tags": [
        "irreplaceability",
        "self-worth",
        "identity",
        "ai-era-values"
      ]
    },
    {
      "id": "worth-doing-without-being-the-only-one",
      "kind": "claim",
      "title": "一件事情值得做，不必因為只有你做得到",
      "body": "努力沒有消失，只是理由改變了。為了證明稀缺性而努力（比別人強、取得 title、確保不被取代）與因為真的想做而努力（想把歌唱好、想知道機構能不能動、想把 side project 做出來、享受試錯後突然成功）是兩種努力；後者不需要以「永遠比 AI 強」作為成立條件。",
      "source_refs": [
        {
          "source_id": "ai-irreplaceability-lived-experience-2026-09-25",
          "path": "sources/inbox/ai-irreplaceability-lived-experience-2026-09-25.md",
          "start_line": 68,
          "end_line": 94,
          "quote": "一件事情值得做，不必因為只有你做得到。"
        }
      ],
      "confidence": 0.96,
      "tags": [
        "effort",
        "intrinsic-motivation",
        "irreplaceability",
        "meaning"
      ]
    },
    {
      "id": "artifact-commodified-experience-not-voided",
      "kind": "claim",
      "title": "成果可以被商品化；經歷不會被追溯作廢",
      "body": "成果（程式、模型、文章、設計、歌曲、研究結果）未來可能被 AI 更快、更好、更便宜地大量生成；但經歷（想到 → 試 → 壞掉 → 改 → 突然成功 →「靠，真的動了」）不能被未來更好的結果倒推證明為白費。那一晚真正被消費的產品本來就不只是最後那份 code 或模型，那段探索本身就是人生的一部分。",
      "source_refs": [
        {
          "source_id": "ai-irreplaceability-lived-experience-2026-09-25",
          "path": "sources/inbox/ai-irreplaceability-lived-experience-2026-09-25.md",
          "start_line": 98,
          "end_line": 127,
          "quote": "成果可以被商品化；經歷不會被追溯作廢。"
        }
      ],
      "confidence": 0.97,
      "tags": [
        "lived-experience",
        "artifact",
        "commoditization",
        "meaning"
      ]
    },
    {
      "id": "scarcity-moves-to-taste-intent-experience",
      "kind": "claim",
      "title": "當 execution 趨近免費，稀缺性上移到 taste、curiosity、intent 與值得活過的經歷",
      "body": "即使 AI 可以找答案、建立關聯、比較路徑、選擇方案、生成成品，人仍然要面對「我到底想把注意力、時間與生命放在哪裡？」。execution 成本越低，真正稀缺的東西越往上移到 taste、curiosity、intent、willingness to experience 與 what feels worth living through；「選擇」不只是選最優答案，也是在選哪一段經歷值得親自活過。",
      "source_refs": [
        {
          "source_id": "ai-irreplaceability-lived-experience-2026-09-25",
          "path": "sources/inbox/ai-irreplaceability-lived-experience-2026-09-25.md",
          "start_line": 131,
          "end_line": 173,
          "quote": "哪一段經歷值得我親自活過。"
        }
      ],
      "confidence": 0.94,
      "tags": [
        "taste",
        "intent",
        "scarcity",
        "ai-selection"
      ]
    },
    {
      "id": "creation-as-lived-activity-rises",
      "kind": "claim",
      "title": "AI 讓作為商品的技能貶值，讓作為活動的創造升值",
      "body": "創作有兩種功能：作為商品（我要產出最好的結果），會受 AI 非常直接的競爭；作為活動（我喜歡進入這個狀態），價值不來自別人做不到。AI 越強，skill as commodity ↓；但 execution 變便宜也讓人把更多注意力放在真正想做、好奇、喜歡的風格與想活過的經歷上，creation as lived activity ↑。極度功利的效率工具，最後可能逼人重新回答：如果我不需要靠「有用」證明自己，我真正想做什麼？",
      "source_refs": [
        {
          "source_id": "ai-irreplaceability-lived-experience-2026-09-25",
          "path": "sources/inbox/ai-irreplaceability-lived-experience-2026-09-25.md",
          "start_line": 190,
          "end_line": 208,
          "quote": "因為我喜歡，所以我做。"
        },
        {
          "source_id": "ai-irreplaceability-lived-experience-2026-09-25",
          "path": "sources/inbox/ai-irreplaceability-lived-experience-2026-09-25.md",
          "start_line": 212,
          "end_line": 234,
          "quote": "creation as lived activity ↑"
        }
      ],
      "confidence": 0.95,
      "tags": [
        "creation",
        "commoditization",
        "intrinsic-motivation",
        "ai-era-values"
      ]
    },
    {
      "id": "ambition-redirected-to-exploration",
      "kind": "decision",
      "title": "不是躺平：把野心從成為不可取代的人轉向探索這一生能走到哪裡",
      "body": "這套觀點不是「反正 AI 會超越我，所以隨便過」，而是把野心從「我要成為某種厲害、稀缺、不可取代的人」移到「我想看看這一生到底可以探索到哪裡」。只為身份與地位而鑽的洞可能突然失去意義；但如果一個洞本身讓你著迷，那就鑽爆它。AI 越強，越能把雜務拿掉，讓人把更多生命花在真正有意思的部分。",
      "source_refs": [
        {
          "source_id": "ai-irreplaceability-lived-experience-2026-09-25",
          "path": "sources/inbox/ai-irreplaceability-lived-experience-2026-09-25.md",
          "start_line": 262,
          "end_line": 282,
          "quote": "我想看看這一生到底可以探索到哪裡。"
        }
      ],
      "confidence": 0.94,
      "tags": [
        "ambition",
        "exploration",
        "curiosity",
        "life-strategy"
      ]
    },
    {
      "id": "outer-inner-principle-pair",
      "kind": "pattern",
      "title": "一外一內：對世界有球來就打，對自己不必證明不可取代",
      "body": "9/21 的結論面向外在世界：未來不必被完全預測，只需保持開放，讓自己有能力隨時重新選擇（方向穩定，路徑流動；保持在場，有球來就打）。9/25 的結論面向內在身份：人生不必用來證明自己不可取代，而可以用來追隨真正的好奇、創造與體驗。兩者合成一外一內的一組原則：外面的世界怎麼變，來了再應對；裡面的自己，不需要和世界比誰更不可取代。",
      "source_refs": [
        {
          "source_id": "ai-irreplaceability-lived-experience-2026-09-25",
          "path": "sources/inbox/ai-irreplaceability-lived-experience-2026-09-25.md",
          "start_line": 238,
          "end_line": 258,
          "quote": "形成一外一內兩條原則"
        },
        {
          "source_id": "ai-irreplaceability-lived-experience-2026-09-25",
          "path": "sources/inbox/ai-irreplaceability-lived-experience-2026-09-25.md",
          "start_line": 298,
          "end_line": 302,
          "quote": "這句話和「有球來就打」是一外一內。"
        }
      ],
      "confidence": 0.95,
      "tags": [
        "principle-pair",
        "life-strategy",
        "identity",
        "play-the-ball"
      ]
    },
    {
      "id": "do-not-miss-the-life-you-want-to-live",
      "kind": "decision",
      "title": "不必成為不可取代的人；只要不要錯過自己真正想活的人生",
      "body": "Source B 最後收斂成一句 durable principle：不必成為不可取代的人；只要不要錯過自己真正想活的人生。人生不必用來證明自己不可取代，而可以用來追隨真正的好奇、創造與體驗——想做什麼，就真正去做。",
      "source_refs": [
        {
          "source_id": "ai-irreplaceability-lived-experience-2026-09-25",
          "path": "sources/inbox/ai-irreplaceability-lived-experience-2026-09-25.md",
          "start_line": 286,
          "end_line": 296,
          "quote": "不必成為不可取代的人；只要不要錯過自己真正想活的人生。"
        },
        {
          "source_id": "ai-irreplaceability-lived-experience-2026-09-25",
          "path": "sources/inbox/ai-irreplaceability-lived-experience-2026-09-25.md",
          "start_line": 304,
          "end_line": 304,
          "quote": "想做什麼，就真正去做。"
        }
      ],
      "confidence": 0.97,
      "tags": [
        "durable-principle",
        "irreplaceability",
        "lived-experience",
        "life-design"
      ]
    }
  ]
}
